{
  "felles": {
    "søkerNavn": "Dolly Duck",
    "søkerPersonnummer": "300220 12345",
    "brevDato": "4. mai 2021",
    "erAutomatiskBehandlet": false,
    "saksnummer": "123456789",
    "ytelseType": "SVP",
    "erUtkast": false
  },
  "revurdering": false,
  "endretFraAvslag": false,
  "utbetalingEndret": false,
  "termindatoEndret": false,
  "refusjonTilBruker": true,
  "antallRefusjonerTilArbeidsgivere": 1,
  "stønadsperiodeTom": "31. juli 2021",
  "månedsbeløp": 15000,
  "mottattDato": "1. juli 2021",
  "klagefristUker": 6,
  "antallUtbetalingsperioder": 1,
  "aktiviteterOgUtbetalingsPerioder": [
    {
      "beskrivelse": "Som næringsdrivende",
      "utbetalingsperioder": [
        {
          "periodeFom": "1. juli 2021",
          "periodeTom": "12. juli 2021",
          "dagsats": 500,
          "utbetalingsgrad": 50.0,
          "utbetaltTilSøker": 200
        }
      ]
    }
  ],
  "inkludereBeregning": true,
  "selvstendigNæringsdrivende": {
    "nyoppstartet": false,
    "årsinntekt": 40000,
    "sistLignedeÅr": 2020,
    "inntektLavereATSN": true,
    "inntektLavereATFLSN": true,
    "inntektLavereFLSN": true
  },
  "bruttoBeregningsgrunnlag": 200000,
  "militærSivil": false,
  "inntektOver6G": false,
  "seksG": 600000,
  "lovhjemmel": "§ 14-4"
}
